{
  "formatId": "protocol-design.vn-academic-thesis-protocol",
  "skeletonVersion": "v1",

  "note": "This is the seed ProseMirror document a new document of this format starts from. Nodes with attrs.locked:true are standard, fixed structure — same wording for any topic or field, extracted from the official template, never edited by the end user (the web editor should render them read-only). Nodes with attrs.fillIn:true are empty on purpose — real content, entirely up to the researcher, not pre-filled with any placeholder text (placeholder/hint text, if wanted, is a front-end display concern, not data that belongs in the document).",

  "doc": {
    "type": "doc",
    "content": [
      { "type": "researchBlock", "attrs": { "blockKind": "tableOfContentsField", "locked": true } },
      { "type": "researchBlock", "attrs": { "blockKind": "listOfTablesField", "locked": true } },

      { "type": "heading", "attrs": { "level": 1, "locked": true, "sectionKind": "problemStatement" },
        "content": [{ "type": "text", "text": "ĐẶT VẤN ĐỀ" }] },
      { "type": "paragraph", "attrs": { "fillIn": true }, "content": [] },

      { "type": "heading", "attrs": { "level": 2, "locked": true, "sectionKind": "researchObjectives" },
        "content": [{ "type": "text", "text": "Mục tiêu nghiên cứu" }] },
      { "type": "paragraph", "attrs": { "fillIn": true }, "content": [] },

      { "type": "heading", "attrs": { "level": 1, "locked": true, "sectionKind": "chapter", "chapterRole": "literatureReview" },
        "content": [{ "type": "text", "text": "CHƯƠNG I: TỔNG QUAN TÀI LIỆU" }] },
      { "type": "paragraph", "attrs": { "fillIn": true, "note": "Entirely open — subsection structure and headings here are the researcher's own literature review, always topic-dependent. The skeleton intentionally does not pre-fill any subheadings here." }, "content": [] },

      { "type": "heading", "attrs": { "level": 1, "locked": true, "sectionKind": "chapter", "chapterRole": "methods" },
        "content": [{ "type": "text", "text": "CHƯƠNG II: PHƯƠNG PHÁP NGHIÊN CỨU" }] },

      { "type": "heading", "attrs": { "level": 2, "locked": true, "sectionKind": "methodsSubsection" },
        "content": [{ "type": "text", "text": "Thiết kế nghiên cứu" }] },
      { "type": "paragraph", "attrs": { "fillIn": true }, "content": [] },

      { "type": "heading", "attrs": { "level": 2, "locked": true, "sectionKind": "methodsSubsection" },
        "content": [{ "type": "text", "text": "Thời gian và địa điểm nghiên cứu" }] },
      { "type": "paragraph", "attrs": { "fillIn": true }, "content": [] },

      { "type": "heading", "attrs": { "level": 2, "locked": true, "sectionKind": "methodsSubsection" },
        "content": [{ "type": "text", "text": "Đối tượng nghiên cứu" }] },
      { "type": "paragraph", "attrs": { "fillIn": true }, "content": [] },

      { "type": "heading", "attrs": { "level": 2, "locked": true, "sectionKind": "methodsSubsection" },
        "content": [{ "type": "text", "text": "Cỡ mẫu và phương pháp chọn mẫu" }] },
      { "type": "paragraph", "attrs": { "fillIn": true }, "content": [] },

      { "type": "heading", "attrs": { "level": 1, "locked": true, "sectionKind": "chapter", "chapterRole": "expectedResults" },
        "content": [{ "type": "text", "text": "CHƯƠNG III: DỰ KIẾN KẾT QUẢ" }] },
      { "type": "paragraph", "attrs": { "fillIn": true, "note": "Open — subheadings here typically correspond 1:1 with however many objectives the researcher declared above, so the count and wording can't be fixed by the skeleton." }, "content": [] },

      { "type": "heading", "attrs": { "level": 1, "locked": true, "sectionKind": "chapter", "chapterRole": "implementationPlan" },
        "content": [{ "type": "text", "text": "CHƯƠNG IV: KẾ HOẠCH THỰC HIỆN" }] },

      { "type": "heading", "attrs": { "level": 2, "locked": true, "sectionKind": "planSubsection" },
        "content": [{ "type": "text", "text": "Nhân lực" }] },
      { "type": "paragraph", "attrs": { "fillIn": true }, "content": [] },

      { "type": "heading", "attrs": { "level": 2, "locked": true, "sectionKind": "planSubsection" },
        "content": [{ "type": "text", "text": "Phương tiện thực hiện" }] },
      { "type": "paragraph", "attrs": { "fillIn": true }, "content": [] },

      { "type": "heading", "attrs": { "level": 2, "locked": true, "sectionKind": "planSubsection" },
        "content": [{ "type": "text", "text": "Kinh phí" }] },
      { "type": "paragraph", "attrs": { "fillIn": true }, "content": [] },

      { "type": "heading", "attrs": { "level": 2, "locked": true, "sectionKind": "planSubsection" },
        "content": [{ "type": "text", "text": "Thời gian biểu các hoạt động" }] },
      { "type": "paragraph", "attrs": { "fillIn": true }, "content": [] },

      { "type": "heading", "attrs": { "level": 2, "locked": true, "sectionKind": "planSubsection" },
        "content": [{ "type": "text", "text": "Dự trù khó khăn" }] },
      { "type": "paragraph", "attrs": { "fillIn": true }, "content": [] },

      { "type": "heading", "attrs": { "level": 1, "locked": true, "sectionKind": "references" },
        "content": [{ "type": "text", "text": "TÀI LIỆU THAM KHẢO" }] },
      { "type": "paragraph", "attrs": { "fillIn": true, "note": "Reference list entries, entirely user/citation-manager supplied." }, "content": [] }
    ]
  }
}
