{
  "formatId": "report-writing.vn-academic-thesis-full",
  "skeletonVersion": "v1",

  "note": "Same conventions as protocol-design.vn-academic-thesis-protocol's skeleton: locked nodes are fixed standard structure, fillIn nodes are open and never pre-filled. This format shares chapters I-II with the protocol skeleton; it differs from Chapter III onward, where a completed thesis reports actual results and a discussion rather than expected results and an implementation plan.",

  "doc": {
    "type": "doc",
    "content": [
      { "type": "researchBlock", "attrs": { "blockKind": "tableOfContentsField", "locked": true } },
      { "type": "researchBlock", "attrs": { "blockKind": "listOfTablesField", "locked": true } },

      { "type": "heading", "attrs": { "level": 1, "locked": true, "sectionKind": "problemStatement" },
        "content": [{ "type": "text", "text": "ĐẶT VẤN ĐỀ" }] },
      { "type": "paragraph", "attrs": { "fillIn": true }, "content": [] },

      { "type": "heading", "attrs": { "level": 2, "locked": true, "sectionKind": "researchObjectives" },
        "content": [{ "type": "text", "text": "Mục tiêu nghiên cứu" }] },
      { "type": "paragraph", "attrs": { "fillIn": true }, "content": [] },

      { "type": "heading", "attrs": { "level": 1, "locked": true, "sectionKind": "chapter", "chapterRole": "literatureReview" },
        "content": [{ "type": "text", "text": "CHƯƠNG I: TỔNG QUAN TÀI LIỆU" }] },
      { "type": "paragraph", "attrs": { "fillIn": true, "note": "Open — topic-dependent literature review, no pre-filled subheadings." }, "content": [] },

      { "type": "heading", "attrs": { "level": 1, "locked": true, "sectionKind": "chapter", "chapterRole": "methods" },
        "content": [{ "type": "text", "text": "CHƯƠNG II: PHƯƠNG PHÁP NGHIÊN CỨU" }] },

      { "type": "heading", "attrs": { "level": 2, "locked": true, "sectionKind": "methodsSubsection" },
        "content": [{ "type": "text", "text": "Thiết kế nghiên cứu" }] },
      { "type": "paragraph", "attrs": { "fillIn": true }, "content": [] },

      { "type": "heading", "attrs": { "level": 2, "locked": true, "sectionKind": "methodsSubsection" },
        "content": [{ "type": "text", "text": "Thời gian và địa điểm nghiên cứu" }] },
      { "type": "paragraph", "attrs": { "fillIn": true }, "content": [] },

      { "type": "heading", "attrs": { "level": 2, "locked": true, "sectionKind": "methodsSubsection" },
        "content": [{ "type": "text", "text": "Đối tượng nghiên cứu" }] },
      { "type": "paragraph", "attrs": { "fillIn": true }, "content": [] },

      { "type": "heading", "attrs": { "level": 2, "locked": true, "sectionKind": "methodsSubsection" },
        "content": [{ "type": "text", "text": "Cỡ mẫu và phương pháp chọn mẫu" }] },
      { "type": "paragraph", "attrs": { "fillIn": true }, "content": [] },

      { "type": "heading", "attrs": { "level": 1, "locked": true, "sectionKind": "chapter", "chapterRole": "results" },
        "content": [{ "type": "text", "text": "CHƯƠNG III: KẾT QUẢ" }] },
      { "type": "paragraph", "attrs": { "fillIn": true, "note": "Open — subheadings typically correspond 1:1 with the declared objectives; count/wording can't be fixed here." }, "content": [] },

      { "type": "heading", "attrs": { "level": 1, "locked": true, "sectionKind": "chapter", "chapterRole": "discussion" },
        "content": [{ "type": "text", "text": "CHƯƠNG IV: BÀN LUẬN" }] },
      { "type": "paragraph", "attrs": { "fillIn": true, "note": "Open. The source template's discussion subheadings (e.g. population characteristics, age/sex breakdown) reflect this one study's clinical-demographic reporting convention, not a universal structure — left unfixed so the format applies outside health-sciences research too." }, "content": [] },

      { "type": "heading", "attrs": { "level": 1, "locked": true, "sectionKind": "references" },
        "content": [{ "type": "text", "text": "TÀI LIỆU THAM KHẢO" }] },
      { "type": "paragraph", "attrs": { "fillIn": true }, "content": [] }
    ]
  }
}
